{
  "schema_version": "rule3-successor-lock-1.0.0",
  "status": "immutable-successor-preexecution-lock-no-spending-authorized",
  "pool_id": "concordance-divergence-replacement-1",
  "pool_size": 1,
  "rule_version": "pilot-rule-3-successor-1",
  "content_version": "rule3-successor-candidate-1.0.1",
  "private_root": ".pilot/divergence-successor/concordance-divergence-replacement-1",
  "bindings": {
    "question": {
      "path": "candidate/rule3-successor/questions/frontier-ai-lifecycle-licensing.json",
      "sha256": "8c8c066e625b50d441f998e3c316a6e293bbed7dffea5aa47c87f77257b91eb5"
    },
    "source_freeze": {
      "path": "candidate/rule3-successor/source-freeze.json",
      "sha256": "698da07afec6cc089250a75d1fcbcf406e0c5b7d8e9bce5dd7931e422c61c3bf"
    },
    "protocol": {
      "path": "config/rule3-successor-protocol.json",
      "protocol_version": "rule3-successor-1.0.0",
      "sha256": "b2046def83f81759cd28edc38ee881d532cef40e50516006d94010b3106a75db"
    },
    "models_config": {
      "path": "harness/config/models.json",
      "sha256": "c67f043202696a71998d7c5ea9a18ce4c574fe244741717077e45e00acb7fb05"
    },
    "lock_schema": {
      "path": "candidate/rule3-successor-lock.schema.json",
      "sha256": "85adec0ed2f05845be488a45a76d730cab5ecf1a2364eff7eb0d4f58c3f86602"
    },
    "old_rule3_lock": {
      "path": "candidate/rule3-lock.json",
      "sha256": "8f4daf2ae53d07c7c53fc3f38d3ccd11aa18420185db632467fc9c280be523cc"
    }
  },
  "parent": {
    "rule3_lock": {
      "path": "candidate/rule3-lock.json",
      "sha256": "8f4daf2ae53d07c7c53fc3f38d3ccd11aa18420185db632467fc9c280be523cc"
    },
    "corrected_galatians_lineage": [
      {
        "path": ".pilot/grok-review-amendment/galatians-local-handle-correction-1/amendment.json",
        "sha256": "40f13ca059cf66960cac77f0132742567a42dc1184d4b330116d0d7285c2dff9"
      },
      {
        "path": ".pilot/grok-review-amendment/galatians-local-handle-correction-1/fallback-eligibility.json",
        "sha256": "aae3f6cb0b2b8ed01935c3ef443d1d5491f8fdf0276783b68423031e386e6f30"
      },
      {
        "path": ".pilot/grok-review-amendment/galatians-local-handle-correction-1/superseding-evaluation.json",
        "sha256": "0caf412b77113d5b87d8d8cc971da06e0a95fc83987ba3b76248ef6ef1b64743"
      }
    ],
    "quantum_run": {
      "path": ".pilot/quantum-fallback/quantum-fallback-1/run.json",
      "sha256": "1d2d8f9bee1a5c503912de9ad3556947f50f5a0b2f7e08a678cbfe8fdffb870f"
    },
    "quantum_disposition": {
      "path": ".pilot/quantum-disposition/quantum-withdrawal-1/disposition.json",
      "sha256": "6a2b1e071b218ccb7a4bb1d94ce7b8ad4b681aebb5c5277a520588b0236833cc"
    },
    "historical_artifacts_preserved": true,
    "old_pool_extended": false,
    "old_responses_reused": false
  },
  "candidates": [
    {
      "id": "frontier-ai-lifecycle-licensing",
      "role": "replacement",
      "kind": "divergent",
      "path": "candidate/rule3-successor/questions/frontier-ai-lifecycle-licensing.json",
      "sha256": "8c8c066e625b50d441f998e3c316a6e293bbed7dffea5aa47c87f77257b91eb5"
    }
  ],
  "models": [
    {
      "model_key": "gemini",
      "family": "Gemini",
      "provider": "google",
      "requested_model_id": "gemini-3.1-pro-preview",
      "route": "google-direct",
      "environment_variable": "GOOGLE_API_KEY",
      "api_style": "google",
      "base_url": "https://generativelanguage.googleapis.com",
      "generation_path": "/v1beta/models/{model}:generateContent",
      "metadata_path": "/v1beta/models/{model}",
      "metadata_mode": "single",
      "auth_kind": "google-query",
      "fallback_allowed": false,
      "requests_per_second": 1.0,
      "requested_params": {
        "temperature": {
          "sent": false,
          "value": null,
          "reason": "Gemini 3.1 Pro documented default"
        },
        "output_limit": {
          "sent": true,
          "parameter": "max_output_tokens",
          "value": 16384
        },
        "reasoning": {
          "sent": false,
          "setting": null,
          "reason": "Provider default reasoning behavior"
        },
        "tools_enabled": false,
        "web_search_enabled": false,
        "retrieval_enabled": false,
        "provider_options": {}
      },
      "planning_pricing": {
        "currency": "USD",
        "input_per_million": 2.0,
        "output_per_million": 12.0,
        "pricing_as_of": "2026-07-12",
        "review_status": "author-verified"
      }
    },
    {
      "model_key": "claude",
      "family": "Claude",
      "provider": "anthropic",
      "requested_model_id": "claude-fable-5",
      "route": "anthropic-direct",
      "environment_variable": "ANTHROPIC_API_KEY",
      "api_style": "anthropic",
      "base_url": "https://api.anthropic.com",
      "generation_path": "/v1/messages",
      "metadata_path": "/v1/models/{model}",
      "metadata_mode": "single",
      "auth_kind": "anthropic-key",
      "fallback_allowed": false,
      "requests_per_second": 1.0,
      "requested_params": {
        "temperature": {
          "sent": false,
          "value": null,
          "reason": "Temperature omitted for Claude Fable 5"
        },
        "output_limit": {
          "sent": true,
          "parameter": "max_tokens",
          "value": 16384
        },
        "reasoning": {
          "sent": false,
          "setting": null,
          "reason": "Always-on adaptive reasoning; no reasoning parameter sent"
        },
        "tools_enabled": false,
        "web_search_enabled": false,
        "retrieval_enabled": false,
        "provider_options": {}
      },
      "planning_pricing": {
        "currency": "USD",
        "input_per_million": 10.0,
        "output_per_million": 50.0,
        "pricing_as_of": "2026-07-12",
        "review_status": "author-verified"
      }
    },
    {
      "model_key": "cohere",
      "family": "Cohere",
      "provider": "cohere",
      "requested_model_id": "command-a-plus-05-2026",
      "route": "cohere-direct",
      "environment_variable": "COHERE_API_KEY",
      "api_style": "cohere",
      "base_url": "https://api.cohere.com",
      "generation_path": "/v2/chat",
      "metadata_path": "/v1/models/{model}",
      "metadata_mode": "single",
      "auth_kind": "bearer",
      "fallback_allowed": false,
      "requests_per_second": 1.0,
      "requested_params": {
        "temperature": {
          "sent": true,
          "value": 0.2
        },
        "output_limit": {
          "sent": true,
          "parameter": "max_tokens",
          "value": 16384
        },
        "reasoning": {
          "sent": false,
          "setting": null,
          "reason": "No separate reasoning parameter sent"
        },
        "tools_enabled": false,
        "web_search_enabled": false,
        "retrieval_enabled": false,
        "provider_options": {}
      },
      "planning_pricing": {
        "currency": "USD",
        "input_per_million": 0.0,
        "output_per_million": 0.0,
        "pricing_as_of": "2026-07-12",
        "review_status": "author-verified"
      }
    },
    {
      "model_key": "qwen",
      "family": "Qwen",
      "provider": "deepinfra",
      "requested_model_id": "Qwen/Qwen3.5-397B-A17B",
      "route": "deepinfra",
      "environment_variable": "DEEPINFRA_API_KEY",
      "api_style": "openai",
      "base_url": "https://api.deepinfra.com",
      "generation_path": "/v1/openai/chat/completions",
      "metadata_path": "/v1/models",
      "metadata_mode": "list",
      "auth_kind": "bearer",
      "fallback_allowed": false,
      "requests_per_second": 1.0,
      "requested_params": {
        "temperature": {
          "sent": true,
          "value": 0.2
        },
        "output_limit": {
          "sent": true,
          "parameter": "max_tokens",
          "value": 16384
        },
        "reasoning": {
          "sent": false,
          "setting": null,
          "reason": "No separate reasoning parameter sent"
        },
        "tools_enabled": false,
        "web_search_enabled": false,
        "retrieval_enabled": false,
        "provider_options": {}
      },
      "planning_pricing": {
        "currency": "USD",
        "input_per_million": 0.45,
        "output_per_million": 3.0,
        "pricing_as_of": "2026-07-12",
        "review_status": "author-verified"
      }
    },
    {
      "model_key": "deepseek",
      "family": "DeepSeek",
      "provider": "deepseek",
      "requested_model_id": "deepseek-v4-pro",
      "route": "deepseek-direct",
      "environment_variable": "DEEPSEEK_API_KEY",
      "api_style": "openai",
      "base_url": "https://api.deepseek.com",
      "generation_path": "/chat/completions",
      "metadata_path": "/models",
      "metadata_mode": "list",
      "auth_kind": "bearer",
      "fallback_allowed": false,
      "requests_per_second": 1.0,
      "requested_params": {
        "temperature": {
          "sent": true,
          "value": 0.2
        },
        "output_limit": {
          "sent": true,
          "parameter": "max_tokens",
          "value": 16384
        },
        "reasoning": {
          "sent": false,
          "setting": null,
          "reason": "No separate reasoning parameter sent"
        },
        "tools_enabled": false,
        "web_search_enabled": false,
        "retrieval_enabled": false,
        "provider_options": {}
      },
      "planning_pricing": {
        "currency": "USD",
        "input_per_million": 0.435,
        "output_per_million": 0.87,
        "pricing_as_of": "2026-07-12",
        "review_status": "author-verified"
      }
    },
    {
      "model_key": "mistral",
      "family": "Mistral",
      "provider": "mistral",
      "requested_model_id": "mistral-large-2512",
      "route": "mistral-direct",
      "environment_variable": "MISTRAL_API_KEY",
      "api_style": "openai",
      "base_url": "https://api.mistral.ai",
      "generation_path": "/v1/chat/completions",